{
  "$schema": "http://json-schema.org/draft-07/schema#",
  "title": "Art Assembly Card",
  "description": "A recipe under data/art/_sets/<group>/<slug>/<stage>/ that combines an identity (heroArt), a stage template, and pieces into one generated prompt (output). Any extra string field is a literal one-off token for the template (the generator treats them that way), so extras are allowed but must be strings. Cross-file integrity (paths exist, outputs unique, link back to a card) is enforced by tools/validators/validate_data.py.",
  "type": "object",
  "required": ["artId", "kind", "stage", "heroArt", "template", "output", "denoise"],
  "properties": {
    "artId": {"type": "string", "pattern": "^[a-z0-9-]+$"},
    "kind": {"const": "base-set"},
    "stage": {"type": "string", "enum": ["edit", "alpha", "pose", "head", "hair", "motion", "armor", "clothing", "showcase", "scene", "polish", "final", "brand", "card"]},
    "heroArt": {"type": "string", "pattern": "^data/art/(heroes|dragons|brand|cards)/.+\\.json$", "description": "Art identity file (which in turn links to the gameplay card)"},
    "template": {"type": "string", "pattern": "^data/art/_templates/.+\\.txt$"},
    "output": {"type": "string", "pattern": "^prompts/[^/]+/.+\\.txt$"},
    "denoise": {"type": "string"},
    "figureProfile": {"enum": ["standard", "individual"], "description": "standard = the hero's X Pose figure from _settings/phrases.json (cards fed the original photo); individual (default) = her own physique"},
    "notes": {"type": "string"},
    "keyDetails": {"type": "array", "items": {"enum": ["hair", "bust", "eyes", "skin", "legs"]}, "uniqueItems": true, "description": "Details called out up front in a Critical details block (and left out of the later lines); overrides the template default"},
    "finish": {"type": "string", "pattern": "^[a-z]+$", "description": "Marks this card as an art edition of its hero's card (key in finishes.json); the card must list it under art.variants"},
    "component": {"type": "string", "pattern": "^data/art/.+\\.json$", "description": "One whole reusable piece (hair, motion)"},
    "components": {
      "type": "object",
      "description": "Named slots -> piece path, literal text, or '+literal' to extend a default",
      "minProperties": 1,
      "additionalProperties": {"type": "string", "minLength": 1}
    },
    "overrides": {
      "type": "object",
      "additionalProperties": false,
      "properties": {
        "palette": {"type": "object"},
        "physique": {"type": "object"},
        "negativeAdd": {"type": "array", "items": {"type": "string"}},
        "negativeRemove": {"type": "array", "items": {"type": "string"}}
      }
    }
  },
  "additionalProperties": {"type": "string"}
}
