{
  "artId": "auriel-hair-braided-updo-loose-tendrils",
  "kind": "base-set",
  "stage": "hair",
  "heroArt": "data/art/heroes/angel-primes/male/auriel.json",
  "component": "data/art/races/human/cosmetics/hair/braided/braided-updo-loose-tendrils.json",
  "template": "data/art/_templates/heroes/2_Studies/hair-human.txt",
  "output": "prompts/angel-primes/male/Auriel/2_Studies/hair/braided/Auriel_Hair_Braided_BraidedUpdoLooseTendrils.txt",
  "denoise": "~0.4-0.6"
}
