{
  "artId": "azaline-x-pose-corset-set",
  "kind": "base-set",
  "stage": "pose",
  "heroArt": "data/art/heroes/angel-primes/female/azaline.json",
  "template": "data/art/_templates/heroes/1_Alpha/pose-female-human.txt",
  "output": "prompts/angel-primes/female/Azaline/3_Layers/lingerie/Azaline_X_Pose_CorsetSet.txt",
  "denoise": "~1.0",
  "components": {
    "underlayer": "data/art/wardrobe/swimwear/lingerie/corset-set.json"
  },
  "notes": "UNDERLAYER TEST: fed the Bare image; only the underlayer piece differs."
}
