{
  "artId": "sammara-hair-thanksgiving",
  "kind": "base-set",
  "stage": "hair",
  "heroArt": "data/art/heroes/angel-primes/female/sammara.json",
  "component": "data/art/themes/seasonal/thanksgiving/cosmetics/hair/braided/harvest-braid-with-leaves.json",
  "template": "data/art/_templates/heroes/2_Studies/hair-human.txt",
  "output": "prompts/angel-primes/female/Sammara/2_Studies/hair/themes/Sammara_Hair_Thanksgiving.txt",
  "denoise": "~0.4-0.6",
  "notes": "Thanksgiving theme hairstyle."
}
