{
  "artId": "urael-x-pose-athletic-trunks",
  "kind": "base-set",
  "stage": "pose",
  "heroArt": "data/art/heroes/angel-primes/male/urael.json",
  "template": "data/art/_templates/heroes/1_Alpha/pose-male-human.txt",
  "output": "prompts/angel-primes/male/Urael/3_Layers/swimwear/Urael_X_Pose_AthleticTrunks.txt",
  "denoise": "~1.0",
  "components": {
    "underlayer": "data/art/wardrobe/swimwear/trunks/athletic-trunks.json"
  },
  "notes": "UNDERLAYER TEST: fed the Bare image; only the underlayer piece differs."
}
