{
  "artId": "haniya-motion-crouch-ready",
  "kind": "base-set",
  "stage": "motion",
  "heroArt": "data/art/heroes/angel-primes/female/haniya.json",
  "template": "data/art/_templates/heroes/Bench/motion-human.txt",
  "output": "prompts/angel-primes/female/Haniya/Bench/motion/action/Haniya_Motion_Action_CrouchReady.txt",
  "denoise": "~0.4-0.6",
  "component": "data/art/motion/action/crouch-ready.json"
}
