{
  "artId": "drakniya-x-pose-chain-harness-bikini",
  "kind": "base-set",
  "stage": "pose",
  "heroArt": "data/art/heroes/drakn-sisters/drakniya-thorne.json",
  "template": "data/art/_templates/heroes/1_Alpha/pose-female-human.txt",
  "output": "prompts/drakn-sisters/Drakniya/3_Layers/backless/Drakniya_X_Pose_ChainHarnessBikini.txt",
  "denoise": "~1.0",
  "components": {
    "underlayer": "data/art/wardrobe/swimwear/backless/chain-harness-bikini.json"
  },
  "notes": "UNDERLAYER TEST. Same original photo as the base A-pose; only the underlayer piece differs."
}
