{
  "artId": "nizaras-x-head",
  "kind": "base-set",
  "stage": "head",
  "heroArt": "data/art/heroes/drakn-bound/nizaras-featherstone.json",
  "template": "data/art/_templates/heroes/head-human.txt",
  "output": "prompts/drakn-bound/Nizaras/head/Nizaras_X_Head.txt",
  "denoise": "~0.4-0.6",
  "notes": "Nizaras Featherstone head/close-up — first-pass minimal scaffold."
}
