{
  "artId": "gavrielle-alpha-prime",
  "kind": "base-set",
  "stage": "alpha",
  "heroArt": "data/art/heroes/angel-primes/gavrielle.json",
  "template": "data/art/_templates/heroes/pose-female-human.txt",
  "output": "prompts/angel-primes/Gavrielle/1_Alpha/1_Prime/Gavrielle_Alpha_1_Prime.txt",
  "denoise": "~1.0",
  "figureProfile": "standard",
  "notes": "Gavrielle Prime A-pose, built from the original photo."
}
