{
  "artId": "luzariel-hair-hollywood-glam-waves",
  "kind": "base-set",
  "stage": "hair",
  "heroArt": "data/art/heroes/angel-primes/male/luzariel.json",
  "component": "data/art/races/human/cosmetics/hair/down/hollywood-glam-waves.json",
  "template": "data/art/_templates/heroes/2_Studies/hair-human.txt",
  "output": "prompts/angel-primes/male/Luzariel/2_Studies/hair/down/Luzariel_Hair_Down_HollywoodGlamWaves.txt",
  "denoise": "~0.4-0.6"
}
