{
  "artId": "drakness-motion-blowing-kiss-full-body",
  "kind": "base-set",
  "stage": "motion",
  "heroArt": "data/art/heroes/drakn-sisters/drakness-thorne.json",
  "component": "data/art/heroes/components/motion/romantic/blowing-kiss-full-body.json",
  "template": "data/art/_templates/heroes/motion-human.txt",
  "output": "prompts/drakn-sisters/Drakness/motion/romantic/Drakness_Motion_Romantic_BlowingKissFullBody.txt",
  "denoise": "~0.4-0.6"
}
