{
  "artId": "drakness-hair-swept-left",
  "kind": "base-set",
  "stage": "hair",
  "heroArt": "data/art/heroes/drakness-thorne.json",
  "component": "data/art/hair/pulled-back/swept-left.json",
  "template": "data/art/base-set/_templates/heroes/hair-human.txt",
  "output": "prompts/art/base-set/Drakness/hair/Drakness_Hair_SweptLeft.txt",
  "denoise": "~0.4-0.6"
}
