{
  "artId": "draknira-motion-hand-on-hip-power",
  "kind": "base-set",
  "stage": "motion",
  "heroArt": "data/art/heroes/drakn-sisters/draknira-thorne.json",
  "component": "data/art/motion/standing/hand-on-hip-power.json",
  "template": "data/art/_templates/heroes/Bench/motion-human.txt",
  "denoise": "~0.4-0.6",
  "output": "prompts/drakn-sisters/Draknira/Bench/motion/standing/Draknira_Motion_Standing_HandOnHipPower.txt"
}
