{
  "artId": "drakness-hair-top-of-breasts-framed",
  "kind": "base-set",
  "stage": "hair",
  "heroArt": "data/art/heroes/drakn-sisters/drakness-thorne.json",
  "component": "data/art/races/human/cosmetics/hair/framed/top-of-breasts-framed.json",
  "template": "data/art/_templates/heroes/2_Studies/hair-human.txt",
  "output": "prompts/drakn-sisters/Drakness/2_Studies/hair/framed/Drakness_Hair_Framed_TopOfBreastsFramed.txt",
  "denoise": "~0.4-0.6"
}
