{
  "artId": "vexiel-motion-slow-sensual-walk",
  "kind": "base-set",
  "stage": "motion",
  "heroArt": "data/art/heroes/angel-primes/male/vexiel.json",
  "template": "data/art/_templates/heroes/Bench/motion-human.txt",
  "output": "prompts/angel-primes/male/Vexiel/Bench/motion/walking/Vexiel_Motion_Walking_SlowSensualWalk.txt",
  "denoise": "~0.4-0.6",
  "component": "data/art/motion/walking/slow-sensual-walk.json"
}
