{
  "artId": "draknora-x-pose-cutout-monokini",
  "kind": "base-set",
  "stage": "pose",
  "heroArt": "data/art/heroes/drakn-sisters/draknora-thorne.json",
  "template": "data/art/_templates/heroes/pose-female-human.txt",
  "output": "prompts/drakn-sisters/Draknora/poses/Draknora_X_Pose_CutoutMonokini.txt",
  "denoise": "~1.0",
  "components": {
    "underlayer": "data/art/wardrobe/swimwear/cutout-monokini.json"
  },
  "notes": "UNDERLAYER TEST. Same original photo as the base A-pose; only the underlayer piece differs."
}
