{
  "artId": "urael-x-head",
  "kind": "base-set",
  "stage": "head",
  "heroArt": "data/art/heroes/angel-primes/urael.json",
  "template": "data/art/_templates/heroes/head-human.txt",
  "output": "prompts/angel-primes/Urael/2_Studies/head/Urael_X_Head.txt",
  "denoise": "~0.4-0.6",
  "notes": "Urael head, the golden head."
}
