{
  "artId": "draknisa-x-pose-lace-bralette-set",
  "kind": "base-set",
  "stage": "pose",
  "heroArt": "data/art/heroes/drakn-sisters/draknisa-thorne.json",
  "template": "data/art/_templates/heroes/pose-female-human.txt",
  "output": "prompts/drakn-sisters/Draknisa/poses/Draknisa_X_Pose_LaceBraletteSet.txt",
  "denoise": "~1.0",
  "components": {
    "underlayer": "data/art/wardrobe/swimwear/lace-bralette-set.json"
  },
  "notes": "UNDERLAYER TEST. Same original photo as the base A-pose; only the underlayer piece differs."
}
