{
  "artId": "draknisa-motion-windswept-dreamy",
  "kind": "base-set",
  "stage": "motion",
  "heroArt": "data/art/heroes/drakn-sisters/draknisa-thorne.json",
  "component": "data/art/motion/romantic/windswept-dreamy.json",
  "template": "data/art/_templates/heroes/motion-human.txt",
  "denoise": "~0.4-0.6",
  "output": "prompts/drakn-sisters/Draknisa/motion/romantic/Draknisa_Motion_Romantic_WindsweptDreamy.txt"
}
