{
  "artId": "azaline-hair-high-ponytail-loose-tendrils",
  "kind": "base-set",
  "stage": "hair",
  "heroArt": "data/art/heroes/angel-primes/female/azaline.json",
  "component": "data/art/races/human/cosmetics/hair/pulled-back/high-ponytail-loose-tendrils.json",
  "template": "data/art/_templates/heroes/2_Studies/hair-human.txt",
  "output": "prompts/angel-primes/female/Azaline/2_Studies/hair/pulled-back/Azaline_Hair_PulledBack_HighPonytailLooseTendrils.txt",
  "denoise": "~0.4-0.6"
}
